family,genus,mobility,substrate,feeding,fixation,functional_reference,FGnum,min,org,base_op_s,base,base_mid,top_op_s,top,top_mid,op_base,op_base_mid,op_top_mid,op_top,gen_laztax,age,gen.surv,known_fossil_record
Malletiidae,Carinineilo,mobile,shallow_infaunal_siphonate,subsurface_deposit,unattached,for family Neilonellidae,9,NA,NA,Zanclean,5.33,4.465,Recent,0,0,5.33,4.465,0,0,FALSE,Rec,R,yes
Malletiidae,Cnesterium,mobile,shallow_infaunal_siphonate,subsurface_deposit,unattached,"taken to be shallow, like Yoldia (see Stanley 1970)",9,NA,NA,Rupelian,33.9,31,Recent,0,0,33.9,31,0,0,FALSE,Rec,R,yes
Malletiidae,Kalayoldia,mobile,shallow_infaunal_siphonate,subsurface_deposit,unattached,"taken to be shallow, like Yoldia (see Stanley 1970)",9,NA,NA,Priabonian_lower,37.8,36.825,Recent,0,0,37.8,36.825,0,0,FALSE,Rec,R,yes
Malletiidae,Katadesmia,mobile,shallow_infaunal_siphonate,subsurface_deposit,unattached,deep pallial sinus,9,NA,NA,Zanclean,5.33,4.465,Recent,0,0,5.33,4.465,0,0,FALSE,Rec,R,yes
Malletiidae,Malletia,mobile,shallow_infaunal_siphonate,subsurface_deposit,unattached,Morton et al. 1998 for family,9,1,2.5,Valanginian_lower,139.4,137.9,Recent,0,0,139.4,137.9,0,0,FALSE,both,S,yes
Malletiidae,Megayoldia,mobile,shallow_infaunal_siphonate,subsurface_deposit,unattached,"taken to be shallow, like Yoldia (see Stanley 1970)",9,NA,NA,Priabonian,37.8,35.85,Recent,0,0,37.8,35.85,0,0,FALSE,Rec,R,yes
Malletiidae,Menneroctenia,mobile,shallow_infaunal_siphonate,subsurface_deposit,unattached,for Malletiidae,9,1,1.5,Santonian,86.3,84.95,Danian_upper,61.6,62.7,86.3,84.95,62.7,61.6,FALSE,Maas,S,yes
Malletiidae,Neilo,mobile,shallow_infaunal_siphonate,subsurface_deposit,unattached,"Morton et al. 1998, Aberhan & Kiessling 2015 Supplement",9,1,2.5,Campanian_lower,83.6,81.685,Recent,0,0,83.6,81.685,0,0,FALSE,both,S,yes
Malletiidae,Neilonella,mobile,shallow_infaunal_siphonate,subsurface_deposit,unattached,Morton et al. 1998 for family,9,1,2.5,Sinemurian,199.3,195.05,Recent,0,0,199.3,195.05,0,0,FALSE,both,S,yes
Malletiidae,Orthoyoldia,mobile,shallow_infaunal_siphonate,subsurface_deposit,unattached,"taken to be shallow, like Yoldia (see Stanley 1970)",9,NA,NA,Ypresian_upper,51.9,49.85,Recent,0,0,51.9,49.85,0,0,FALSE,Rec,R,yes
Malletiidae,Perrisonota,mobile,shallow_infaunal_siphonate,subsurface_deposit,unattached,for Malletiidae,9,1,2.62,Albian_middle,108.83,106.75,Maastrichtian_upper,66,67.5,108.83,106.75,67.5,66,FALSE,Maas,V,yes
Malletiidae,Portlandia,mobile,shallow_infaunal_siphonate,subsurface_deposit,unattached,"often discussed as deposit feeder in ecological studies, and Killeen & Turner, JA note similarity to Yoldiella, so taken to be same function as most yoldiids. They note Coan et al. 2000 describing an inhalent siphon that opens ventrally (also casually noted in Coan& Valentich-Scott Trop W Amer p. 85.",9,1,1.5,Barremian,130.8,128.55,Recent,0,0,130.8,128.55,0,0,FALSE,both,S,yes
Malletiidae,Pristigloma,mobile,infaunal_asiphonate,subsurface_deposit,unattached,"Allen & Sanders 1973:256 Fig. 22 say ""nonsiphonate Pristiglomidae""",18,NA,NA,Zanclean,5.33,4.465,Recent,0,0,5.33,4.465,0,0,FALSE,Rec,R,yes
Malletiidae,Pseudoglomus,mobile,shallow_infaunal_siphonate,subsurface_deposit,unattached,for Malletiidae,9,NA,NA,NA,0,0,NA,0,0,0,0,0,0,FALSE,Rec,R,no
Malletiidae,Pseudomalletia,mobile,shallow_infaunal_siphonate,subsurface_deposit,unattached,for Malletiidae,9,NA,NA,Zanclean,5,4,Recent,0,0,5,4,0,0,FALSE,Rec,R,yes
Malletiidae,Pseudoneilonella,mobile,shallow_infaunal_siphonate,subsurface_deposit,unattached,for family Neilonellidae,9,NA,NA,Langhian,15.97,14.895,Recent,0,0,15.97,14.895,0,0,FALSE,Rec,R,yes
Malletiidae,Pseudotindaria,mobile,shallow_infaunal_siphonate,subsurface_deposit,unattached,taken to be same as other neilonelldis,9,NA,NA,Ypresian_upper,51.9,49.85,Recent,0,0,51.9,49.85,0,0,FALSE,Rec,R,yes
Malletiidae,Sarepta,mobile,shallow_infaunal_siphonate,subsurface_deposit,unattached,taken to be shallow bec of small size of shelf-depth spp (5-12 mm),9,1,1.5,Olenekian_upper,248.6,247.85,Recent,0,0,248.6,247.85,0,0,FALSE,both,S,yes
Malletiidae,Scissileda,mobile,shallow_infaunal_siphonate,subsurface_deposit,unattached,"Kilburn 1994:165 descr genus, notes relatively deep pallial sinus, so siphonate, notes ecology on p. 168 as assoc. w muddy substrates, with other species in more sandy muds, does not note feeding.",9,NA,NA,Burdigalian_upper,18.21,17.09,Recent,0,0,18.21,17.09,0,0,FALSE,Rec,R,yes
Malletiidae,Tindaria,mobile,infaunal_asiphonate,subsurface_deposit,unattached,"protobanch lacking siphons - Verrill & Bush 1997, Waren 1989, La Perna 2008",18,NA,NA,Danian_upper,63.8,62.7,Recent,0,0,63.8,62.7,0,0,FALSE,Rec,R,yes
Malletiidae,Yoldia,mobile,shallow_infaunal_siphonate,subsurface_deposit,unattached,"Stanley 1970:117 as very active and rapid burrower and ""genus live[s] with the shell completely buried, and proboscidial feeding takes place entirely beneath the sediment surface""...""tips of the siphons normally stand 2 to 3 mm above the soupy sediment surface""; La Perna & Raigani 2008:296 ""Surface feeding was proved to be adopted by Yoldia hyperborea in response to algal blooms (Stead & Thompson, 2006); Huber 2015 reports species from fish stomachs, which indirectly implies a near-surface lifestyle.",9,1,1.5,Albian_upper,104.67,102.585,Recent,0,0,104.67,102.585,0,0,FALSE,both,S,yes
Malletiidae,Yoldiella,mobile,shallow_infaunal_siphonate,subsurface_deposit,unattached,"Morton et al. 1998; small, with shallow pallial sinus; see also Kilburn 1994",9,1,1.5,Maastrichtian,72.1,69.05,Recent,0,0,72.1,69.05,0,0,FALSE,both,S,yes
Margaritidae,Pinctada,immobile,epifaunal,suspension,byssate,"assumed to be largely immobile throughout life, but note that in aquarium settings, can detach byssus and move several cm a day (Giraldes et al. 2019)",8,NA,NA,Rupelian,33.9,31,Recent,0,0,33.9,31,0,0,FALSE,Rec,R,yes
Mesodesmatidae,Amarilladesma,mobile,deep_infaunal_siphonate,suspension,unattached,"Huber 2015 Excel file ""usually deeply (up to 20 cm) buried in sandy bottoms; 98mm""; Narci 1981, discussed in Kondo & Stace 1995:75; observed to burrowing to between 20-80mm in Cled¾n & Nu±ez 2009:Fig 1 [longer shells are found deeper]",5,NA,NA,Ionian,0.78,0.395,Recent,0,0,0.78,0.395,0,0,FALSE,Rec,R,yes
Mesodesmatidae,Amesodesma,mobile,shallow_infaunal_siphonate,suspension,unattached,"species mostly small acc. to Huber 2015 (<20mm), with one reaching 33 mm. No descr of relative burrowing depth, but one as in holdfasts of shrubs; pallial sinus relatively short in A. elongata (biv3d meshid 3455), extends 1/4 of total shell length from posterior margin",3,NA,NA,Tortonian-Messinian,11.63,8.48,Recent,0,0,11.63,8.48,0,0,FALSE,Rec,R,yes
Mesodesmatidae,Anapella,mobile,shallow_infaunal_siphonate,suspension,unattached,no pallial sinus in biv3d meshid 2891 and genus noted as lacking siphon Cotton 1961:294,3,NA,NA,Piacenzian,3.6,3.095,Recent,0,0,3.6,3.095,0,0,FALSE,Rec,R,yes
Mesodesmatidae,Atactodea,mobile,shallow_infaunal_siphonate,suspension,unattached,"Oliver et al. 2023:510 ""free living in mobile sands at mid tide levels.""; pallial sinus very shallow, less than 1/4 total body length from the posterior margin (for biv3d meshid 2870 Atactodea striata (Gmelin 1791)",3,NA,NA,Piacenzian,3.6,3.095,Recent,0,0,3.6,3.095,0,0,FALSE,Rec,R,yes
Mesodesmatidae,Ceronia,mobile,deep_infaunal_siphonate,suspension,unattached,"Stanley 1970:167 observes Mesodesma arctatum (Conrad) (=Ceronia acc. to Huber 2015) as deep burrower ""depth of burial is equal to one-half or three-quarters of the shell length (PI. 26, fig. 9 shows specimens burowed to 15mm). Individuals living intertidally were observed to occupy life positions at about twice this depth of burial when the tide was out. Apparently, they dig more deeply into the sediment with the falling tide to seek protection from heat and dessication.""",5,NA,NA,Priabonian,37.8,35.85,Recent,0,0,37.8,35.85,0,0,FALSE,Rec,R,yes
Mesodesmatidae,Ceroniola,mobile,deep_infaunal_siphonate,suspension,unattached,"large bodied (41mm long), very elongate, no mention of pallial sinus in Stinnesbeck 1986 but Wilckens 1904:250 describes sinus as [translated] ""The mantle line arises not from the bottom of the posterior impression, but more in the middle, forming a rounded sinus before sharply bending forward.""; taken to be deep given elongate form and size",5,1,3,Maastrichtian,72.1,69.05,Maastrichtian,66,69.1,72.1,69.05,65.5,65,TRUE,Maas,S,yes
Mesodesmatidae,Coecella,mobile,shallow_infaunal_siphonate,suspension,unattached,"Huber 2015 Excel cites most species as having small pallial sinus, C. chinensis biv3d meshid 3434 shows pallial sinus extending no more than 1/4 total body length",3,NA,NA,Pleistocene,1.81,0.91,Recent,0,0,1.81,0.91,0,0,FALSE,Rec,R,yes
Mesodesmatidae,Davila,mobile,shallow_infaunal_siphonate,suspension,unattached,"28 mm in Huber 2015, no mention of burrowing depth.",3,NA,NA,NA,0,0,NA,0,0,0,0,0,0,FALSE,Rec,R,no
Mesodesmatidae,Donacilla,mobile,shallow_infaunal_siphonate,suspension,unattached,"Huber 2015 Excel notes that Donacilla cornea (G. S. Poli 1791) buried (up to 10cm) in coarse sand, but size 28mm; sinus depth in both species D. cornea and D. picta are relatively shallow, extending no more than 1/4 total body length from the posterior margin, and Whiteley & Owen 1997:478 ""filter-feeder and, when immersed, extends short siphons above the sand surface; although frequently exposed to view by wave scour, it normally lives just below the substrate surface.""",3,NA,NA,Burdigalian_upper,18.21,17.09,Recent,0,0,18.21,17.09,0,0,FALSE,Rec,R,yes
Mesodesmatidae,Mesodesma,mobile,deep_infaunal_siphonate,suspension,unattached,"Narchi 1981, Mondal & Harries 2016 as shallow burrower; Huber 2015 says ""Mesodesma ((Mesodesma) donacium (Lamarck 1818) deeply (5-20cm) buried in fine sand"" and Signorelli 2019:96 ""mentions the remarkable gaped posterior end in M. donacium"" but that the pallial sinus is short; Riascos et al. 2008 note the species burrows to a depth of around 10 cm, but can reach 25 cm if disturbed; 10cm deep in Arntz et al. 1987.",5,NA,NA,Piacenzian,3.6,3.095,Recent,0,0,3.6,3.095,0,0,FALSE,Rec,R,yes
Mesodesmatidae,Paphies,mobile,shallow_infaunal_siphonate,suspension,unattached,"Paphies australis large (83mm) in Huber. Hull et al. 2009 note active burrower but apparently lives close to the sediment water interface owing to it's relative short siphons (pallial sinus does not reach more than 1/4 of the shell length from the posterior margin). Other species in genus burrow deep, see Kondo & Stace 1995 study Paphies (Taria) ventricosa and observe maximum burrowing depth up to 1.7 times the shell length (see fa",3,NA,NA,Bartonian_upper,39.5,38.65,Recent,0,0,39.5,38.65,0,0,FALSE,Rec,R,yes
Mesodesmatidae,Paphies,mobile,deep_infaunal_siphonate,suspension,unattached,Kondo & Stace 1995 study Paphies (Taria) ventricosa and observe maximum burrowing depth up to 1.7 times the shell length (see fantastic Fig. 5 that shows relationship between burrowing depth and shell length).,5,NA,NA,Bartonian_upper,39.5,38.65,Recent,0,0,39.5,38.65,0,0,FALSE,Rec,R,yes
Mesodesmatidae,Regterenia,mobile,shallow_infaunal_siphonate,suspension,unattached,only species 7.5mm in Huber 2015,3,NA,NA,Pleistocene,1.81,0.91,Recent,0,0,1.81,0.91,0,0,FALSE,Rec,R,yes
Monopleuridae,Artigesia,immobile,semi-infaunal,photosymbiotic,unattached,"elevator - RV conical, LV cap-like - Freneix & Sornay 1974",2,1.5,2.5,Maastrichtian_lower,72.1,70.575,Maastrichtian_upper,66,67.5,72.1,70.575,66.1,66,FALSE,Maas,V,yes
Monopleuridae,Gyropleura,immobile,epifaunal,photosymbiotic,cemented,clinger - Gili & Skelton 1993,19,1.5,2.5,Aptian_lower,126.3,124.65,Maastrichtian_upper,66,67.5,126.3,124.65,65.5,65,TRUE,Maas,S,yes
Monopleuridae,Monopleura,immobile,semi-infaunal,photosymbiotic,unattached,elevator - Gili et al. 1995,2,1.5,2.5,Berriasian_lower,145,144.25,Maastrichtian_upper,66,67.5,145,144.25,67.5,66,FALSE,Maas,V,yes
Myidae,Arenomya,immobile,deep_infaunal_siphonate,suspension,unattached,"family ""essentially immobile"" - Southern Synthesis p. 364; M. arenaria to 10-20 cm - Stanley 1970:190-191 discusses capacity to reburrow in laboratory settings when sediment is fluidized, but in nature, most live among seagrass roots and more compact sediments, suggesting that burrowing is likely to be limited. The siphons also fill a permanent tube.",22,NA,NA,Ypresian_lower,56,53.95,Recent,0,0,56,53.95,0,0,FALSE,Rec,R,yes
Myidae,Cryptomya,mobile,commensal,suspension,byssate,"Huber 2015 says C. californica, type sp, is *byssate*; Lawry 1987 observes their burrowing behavior, so mobile; commensal with burrowing shrimp - Morris et al. 1980:386-387; see also Yonge 1951, Griffin et al. 2004; see additional references supporting commensal lifestyle in Zhang et al. 2012",33,NA,NA,Bartonian,41.2,39.5,Recent,0,0,41.2,39.5,0,0,FALSE,Rec,R,yes
Myidae,Distugonia,mobile,shallow_infaunal_siphonate,suspension,unattached,"only sp 21 mm, so taken to be shallow and assumed to be mobile given small body size; slight posterior gape with shallow sinus extending to posterior adductor (Zhang et al. 2012)",3,NA,NA,NA,0,0,NA,0,0,0,0,0,0,FALSE,Rec,R,no
Myidae,Indosphenia,mobile,shallow_infaunal_siphonate,suspension,byssate,"Oliver et al. 2018:31 as byssate, very short pallial sinus, species lives in sediment with the anterior end at, or close to, the sediment surface, asssumed to be mobile given shallow habit",11,NA,NA,NA,0,0,NA,0,0,0,0,0,0,FALSE,Rec,R,no
Myidae,Mya,immobile,deep_infaunal_siphonate,suspension,unattached,"family ""essentially immobile"" - Southern Synthesis p. 364. M. truncata burrows to >20 cm - Aitkin et al. 1988.",22,NA,NA,Ypresian_lower,56,53.95,Recent,0,0,56,53.95,0,0,FALSE,Rec,R,yes
Myidae,Platyodon,immobile,borer,suspension,unattached,"Morris et al. 1980: 387, Coan et al. 2000",15,NA,NA,Chattian,28.1,25.565,Recent,0,0,28.1,25.565,0,0,FALSE,Rec,R,yes
Myidae,Sphenia,immobile,nestler,suspension,byssate,"Coan & Valentich-Scott 2012, Oliver et al. 2018:30 ; immobile in NMITA website",27,NA,NA,Danian_upper,63.8,62.7,Recent,0,0,63.8,62.7,0,0,FALSE,Rec,R,yes
Myidae,Tugonella,mobile,shallow_infaunal_siphonate,suspension,unattached,"L = 17-30mm, so taken to be shallow and assumed to be mobile",3,NA,NA,Pliocene,5.33,3.96,Recent,0,0,5.33,3.96,0,0,FALSE,Rec,R,yes
Myidae,Tugonia,mobile,shallow_infaunal_siphonate,suspension,unattached,"L 42-45mm, pallial sinus shallow, so taken to be shallow-infaunal",3,NA,NA,Ypresian,56,51.9,Recent,0,0,56,51.9,0,0,FALSE,Rec,R,yes
Myidae,Venatomya,mobile,commensal,suspension,byssate,"Huber 2015 Excel file; no data on attachment, so following byssate for Cryptomya (of which this is a subgenus)",33,NA,NA,Burdigalian_upper,18.21,17.09,Recent,0,0,18.21,17.09,0,0,FALSE,Rec,R,yes
Myochamidae,Hunkydora,mobile,shallow_infaunal_siphonate,suspension,unattached,Mollusca: The Southern Synthesis,3,NA,NA,Chattian_upper,25.57,24.3,Recent,0,0,25.57,24.3,0,0,FALSE,Rec,R,yes
Myochamidae,Myadora,mobile,shallow_infaunal_siphonate,suspension,unattached,"Mollusca: The Southern Synthesis: short siphons, small pallial sinus; Morton 1977:142 as buried 10-20mm below the surface of the sand",3,NA,NA,Bartonian_upper,39.5,38.65,Recent,0,0,39.5,38.65,0,0,FALSE,Rec,R,yes
Myochamidae,Myadoropsis,mobile,shallow_infaunal_siphonate,suspension,unattached,Mollusca: The Southern Synthesis,3,NA,NA,Burdigalian_upper,18.21,17.09,Recent,0,0,18.21,17.09,0,0,FALSE,Rec,R,yes
Myochamidae,Myochama,immobile,epifaunal,suspension,cemented,Southern Synthesis p. 402 also in Harper and Morton 2001; as cemented in Morton 2003,7,NA,NA,Chattian_lower,28.1,26.835,Recent,0,0,28.1,26.835,0,0,FALSE,Rec,R,yes
Myophorellidae,Bobkovaella,mobile,infaunal_asiphonate,suspension,unattached,"inferred to be same functional ecology as Trigoniidae, see EscheverrĒa 2014",1,1,1,Santonian_lower,86.3,85.65,Maastrichtian_upper,66,67.5,86.3,85.65,67.5,66,FALSE,Maas,V,yes
Myophorellidae,Popenoella,mobile,infaunal_asiphonate,suspension,unattached,"inferred to be same functional ecology as Trigoniidae, see EscheverrĒa 2014",1,1,1,Turonian_lower,93.9,93.215,Maastrichtian,66,69.1,93.9,93.215,69.1,66,FALSE,Maas,V,yes
Myophorellidae,Tashiroella,mobile,infaunal_asiphonate,suspension,unattached,"inferred to be same functional ecology as Trigoniidae, see EscheverrĒa 2014",1,1,1,Campanian_lower,83.6,81.685,Maastrichtian,66,69.1,83.6,81.685,69.1,66,FALSE,Maas,V,yes
Myophorellidae,Yeharella,mobile,infaunal_asiphonate,suspension,unattached,"inferred to be same functional ecology as Trigoniidae, see EscheverrĒa 2014",1,1,1,Cenomanian,100.5,97.2,Maastrichtian,66,69.1,100.5,97.2,69.1,66,FALSE,Maas,V,yes
Mytilidae,Adipicola,mobile,epifaunal,chemosymbiotic,byssate,"for feeding: Taylor & Glover 2010, also Oliver & Taylor 2012:81; mobility inferred from known asssociation with deep sea vents and with whale falls ""Adipicola and Idas, predominantly live on sunken wood or whale skeletons"" (Laming 2014); Huber 2015 and Knudsen 1979 for A. longissima as ""attached and half buried to sunken fruits of coconut or nipa palm fruits"", with Knudsen saying large anterior lobe and well-developed anterior adductor, so could be taken to be semi-infaunal, but kept epifaunal here",39,NA,NA,Priabonian_upper,35.85,34.875,Recent,0,0,35.85,34.875,0,0,FALSE,Rec,R,yes
Mytilidae,Adula,immobile,borer,suspension,byssate,"Boring: Huber 2015; byssate per Yonge 1955; species examined are A. falcata and A. californiensis; ""free-living, mud flats, crevices"" per Audino et al. 2020 citing Soot-Ryen 1955, Ockelmann and Dinesen 2009",28,NA,NA,Danian,66,64,Recent,0,0,66,64,0,0,FALSE,Rec,R,yes
Mytilidae,Amygdalum,immobile,infaunal_asiphonate,suspension,unattached,"Kay 1979, Zhongyan 2004; builds nests ""bags"" out of byssal threads in soft muds, many refs, see Oliver 2001, who also descsribes the mussels as being ""cocooned"" which implies immobility; ""soft mud, byssal nest"" per Audino et al. 2020 citing Lee & Morton 1985; D'Alessandro & La Perna 2004:727 noted as being sampled from undisturbed box cores with the posterior margin at mud-water interface. Oliver 2001 refers to inhalent and exhalent aperatures, no mention of siphon. Soot-Ryen 1955:71 for descr. of A. americanum provides similar mantle edge morphologies, suggesting that the exhalent aperature [my words] forms a small siphon. We take this condition to effectively be asiphonate, constraining the animal to live at the sediment water interface, not siphonate as for venerids, etc.; Knudsen 1979:208 for A. politum as having well-developed byssus and forming nests, shell with anterior lobe and large anterior adductor",32,1.5,1.25,Hauterivian_upper,132.1,131.45,Recent,0,0,132.1,131.45,0,0,FALSE,both,S,yes
Mytilidae,Arcomytilus,mobile,epifaunal,suspension,byssate,"F³rsich 1980:293 ōthe mytilid Arcomytilus morrisi (SHARVE) is clearly an epibyssate species forming spaced clusters on bedding planes within the Upper Jurassic of Portugal. Commonly, these densely packed clusters center on large shells or shell fragments of oysters or other animals (Fig. 7). Their mode of life is identical with that of modern Mytilus edulis or several species of Brachydontes (STANLEY1970).ö; functional call the same in Schneider, F³rsich, et al. 2010",4,1,1.5,Toarcian_lower,182.7,181.265,Bartonian_lower,39.5,40.4,182.7,181.265,40.4,39.5,FALSE,Maas,S,yes
Mytilidae,Arcuatula,immobile,shallow_infaunal_siphonate,suspension,unattached,"infaunal, ""mud, in a gelatinous byssal net; sand and mudflats, in a byssal nest"" per Audino et al. 2020 citing Morton 1974 (see his Fig. 1), Morton 1980, Lee and Morton 1985, Ong Cge and Morton 1991, Leung and Morton 1997, 2000; Huber 2015 and Southern Synthesis as epifaunal byssate; Audino et al. 2020 say long siphon, which in their scheme equates to both an inhalent and exhalent siphon, extending beyond the mantle margin, so operationally siphonate here; Bernard et al. 2020 observe live specimens with short siphons emerging from sediment",30,NA,NA,Danian_upper,64,63,Recent,0,0,64,63,0,0,FALSE,Rec,R,yes
Mytilidae,Arenifodiens,mobile,shallow_infaunal_siphonate,suspension,byssate,"Huber 2015 says ""deeply buried""; Wilson 2006 notes specimens use byssus to pull themselves to the bottom of the burrow, does not form byssal cocoon, also notes thick, muscular siphons",11,NA,NA,Ionian,0.78,0.395,Recent,0,0,0.78,0.395,0,0,FALSE,Rec,R,yes
Mytilidae,Arvella,mobile,epifaunal,suspension,byssate,Zhongyan 2004; photos of living memebers bysally attached to seaweed on iNaturalist Sept 2024,4,NA,NA,Lutetian_upper,44.5,42.85,Recent,0,0,44.5,42.85,0,0,FALSE,Rec,R,yes
Mytilidae,Aulacomya,mobile,epifaunal,suspension,byssate,"Huber 2015, Southern Synthesis; ""EF rocks and mussels Soot-Ryen 1955"" per Audino et al. 2020",4,NA,NA,Lutetian,47.8,44.5,Recent,0,0,47.8,44.5,0,0,FALSE,Rec,R,yes
Mytilidae,Bathymodiolus,mobile,epifaunal,chemosymbiotic,byssate,"Lenihan et al. 2008 ""B. thermophilus is highly mobile""; ""Bathymodiolus boomerang, which lives partly buried in the sediment at the Barbados seeps (Cosel and Olu, 1998; Duperron, 2010)"" - Duperron et al. 2013, Biogeosciences",39,NA,NA,Priabonian,37.8,35.85,Recent,0,0,37.8,35.85,0,0,FALSE,Rec,R,yes
Mytilidae,Botula,immobile,borer,suspension,byssate,"Kay 1979; Yonge 1955; byssate and boring in Wilson & Tait 1984; boring in Audino et al. 2020 citing Lee and Morton 1985, Huang et al. 1992, Turgeon et al. 2009",28,1.5,2,Aptian_lower,126,125,Recent,0,0,126,125,0,0,FALSE,both,S,yes
Mytilidae,Brachidontes,mobile,epifaunal,suspension,byssate,"Kay 1979; Stanley 1970 for most species, but note B. cintrinus (=B. modiolus) is nearly entirely infaunal; NMITA SAYS WN/EP/SI; ""hard substrate, rocks Tanaka 2005, Trovant et al. 2013"" per Audino et al. 2020",4,2,1.25,Aptian_lower,126.3,124.65,Recent,0,0,126.3,124.65,0,0,FALSE,both,S,yes
Mytilidae,Choromytilus,mobile,epifaunal,suspension,byssate,"Huber says ""attached to rocks"", Southern Synthesis",4,NA,NA,Aquitanian-Burdigalian,23.03,19.5,Recent,0,0,23.03,19.5,0,0,FALSE,Rec,R,yes
Mytilidae,Ciboticola,mobile,epifaunal,suspension,byssate,Huber 2015; Southern Synthesis,4,NA,NA,NA,0,0,NA,0,0,0,0,0,0,FALSE,Rec,R,no
Mytilidae,Crenella,immobile,infaunal_asiphonate,suspension,unattached,"Morton et al. 2016 say C. decussata form an adventicious crypt with mucus, not byssal strands, form tubes using the foot, so lacks siphons, so infaunal; does not match Stanley 1986 ""epifaunal byssate"" or NMITA; ""infaunal soft substrate Turgeon et al. 2009 [Gulf Mx Book], Morton 1974, who says [Other mytilids such as Crenella are sublittoral and, judged by their shape, infaunal (Tebble 1966).]"" per Audino et al. 2020; Audino et al. 2020 say short siphon, which in their scheme equates to inhalent aperature and exhalent siphon that is nearly flush with mantle margin, so operationally is asiphonate here.; additional life position illustrations in Hickman 2023.",32,2,2,Hauterivian_lower,133.9,133,Recent,0,0,133.9,133,0,0,FALSE,both,S,yes
Mytilidae,Crenomytilus,mobile,epifaunal,suspension,byssate,Huber 2015; Southern Synthesis; Stanley 1986 epifaunal byssate,4,NA,NA,Ypresian_upper,52,50,Recent,0,0,52,50,0,0,FALSE,Rec,R,yes
Mytilidae,Dacrydium,immobile,infaunal_asiphonate,suspension,unattached,"""infaunal; nest of sand grains, bottom materials, mud Turgeon et al. 2009, Mattson and Waren 1977, Salas 1996"" per Audino et al. 2020, who say asiphonate on p. 10; Knudsen 1979:208 citing Knudsen 1970 says one spp reported to live in nest made of byssal threads covered by forams and sponge spicules, and shell has anterior lobe and well-developed anterior adductor [SME: which would suggest infaunal to semi-infaunal mode of life, and treating as same function for other mytilids that form byssal nests]; Dupperon et al. 2013 say chemosymbiosis has NOT been investigated, so assumed to suspension feed for now; NMITA as epifaunal",32,NA,NA,Langhian_lower,15.97,15.435,Recent,0,0,15.97,15.435,0,0,FALSE,Rec,R,yes
Mytilidae,Diberus,immobile,borer,suspension,byssate,Huber 2015 descr most spp as chemically boring into (dead) corals,28,NA,NA,Chattian,28.1,25.565,Recent,0,0,28.1,25.565,0,0,FALSE,Rec,R,yes
Mytilidae,Exosiperna,mobile,epifaunal,suspension,byssate,Southern Synthesis,4,NA,NA,Priabonian,37.8,36,Recent,0,0,37.8,36,0,0,FALSE,Rec,R,yes
Mytilidae,Fungiacava,immobile,borer,suspension,byssate,"Huber 2015 says ""living free as endoparasite of coral hosts""; Huber 2010: boring; byssate (per Goreau et al 1972)",28,NA,NA,Pleistocene,1.81,0.91,Recent,0,0,1.81,0.91,0,0,FALSE,Rec,R,yes
Mytilidae,Geukensia,immobile,infaunal_asiphonate,suspension,unattached,"Morton 1980:Fig. 1 for Arcuatula elegans (=Geukensia acc. to Huber 2015) as cocooned in a byssal nest; ""SF mud Owada 2007"" per Audino et al. 2020",32,NA,NA,Pliocene,5.33,3.96,Recent,0,0,5.33,3.96,0,0,FALSE,Rec,R,yes
Mytilidae,Gibbomodiola,mobile,semi-infaunal,suspension,byssate,Southern Synthesis; shell morph looks semi-infaunal to DJ (assuming Modiolus s.s. semi-infaunal too).,17,NA,NA,Rupelian,33.9,31,Recent,0,0,33.9,31,0,0,FALSE,Rec,R,yes
Mytilidae,Gigantidas,mobile,epifaunal,chemosymbiotic,byssate,"Taylor & Glover 2010, also Oliver & Taylor 2012:81 for feeding; Hiebenthal et al. 2021: ""unknown sense organs guide larvae and then adults to locations with optimum methane supply"" , so taken to be mobile here; ""epifunal, cold seeps Duperron et al. 2007; hydrocarbon seeps Turgeon et al. 2009, Lorion et al. 2010"" per Audino et al. 2020",39,NA,NA,Serravallian,13.82,12.725,Recent,0,0,13.82,12.725,0,0,FALSE,Rec,R,yes
