family,genus,mobility,substrate,feeding,fixation,functional_reference,FGnum,min,org,base_op_s,base,base_mid,top_op_s,top,top_mid,op_base,op_base_mid,op_top_mid,op_top,gen_laztax,age,gen.surv,known_fossil_record
Radiolitidae,Lapeirousella,immobile,semi-infaunal,photosymbiotic,unattached,RV conical w/longitudinal ribs - Treatise,2,1.5,2.5,Turonian_upper,91.17,90.485,Maastrichtian_upper,66,67.5,91.17,90.485,67.5,66,FALSE,Maas,V,yes
Radiolitidae,Lapeirousia,immobile,semi-infaunal,photosymbiotic,unattached,"RV cylindrical to ""depressed convex"", LV operculiform, flat or convex - Treatise",2,1.5,2.5,Coniacian_upper,87.47,86.885,Maastrichtian_upper,66,67.5,87.47,86.885,67.5,66,FALSE,Maas,V,yes
Radiolitidae,Macgillavryia,immobile,semi-infaunal,photosymbiotic,unattached,elevator - Mitchell 2002,2,1.5,2.5,Campanian_lower,83.6,81.685,Maastrichtian_upper,66,67.5,83.6,81.685,67.5,66,FALSE,Maas,V,yes
Radiolitidae,Medeella,immobile,semi-infaunal,photosymbiotic,unattached,similar to other elevator radiolitids,2,1.5,2.5,Coniacian_middle,88.63,88.05,Maastrichtian_upper,66,67.5,88.63,88.05,67.5,66,FALSE,Maas,V,yes
Radiolitidae,Miseia,immobile,semi-infaunal,photosymbiotic,unattached,RV conical - S?č?Ēs?č?Ēran et al. 2015,2,1.5,2.5,Santonian_lower,86.3,85.65,Maastrichtian_upper,66,67.5,86.3,85.65,67.5,66,FALSE,Maas,V,yes
Radiolitidae,Osculigera,immobile,semi-infaunal,photosymbiotic,unattached,"elevator - conical RV, thin (possibly translucent) upper, LV - Vogel 1975, Seilacher & Gishlick 2014",2,1.5,2.5,Campanian_lower,83.6,81.685,Maastrichtian_upper,66,67.5,83.6,81.685,67.5,66,FALSE,Maas,V,yes
Radiolitidae,Petkovicia,immobile,semi-infaunal,photosymbiotic,unattached,similar to Gojanovicia - cf. Cestari 1992,2,1.5,2.5,Turonian_upper,91.17,90.485,Maastrichtian_upper,66,67.5,91.17,90.485,67.5,66,FALSE,Maas,V,yes
Radiolitidae,Praeradiolites,immobile,epifaunal,photosymbiotic,cemented,"elevator - Gili et al. 1995 (""certain species""), Laviano 1996, but Moro 1997 Palaeo-3 says elevator",19,1.5,2.5,Cenomanian_lower,100.5,99.4,Maastrichtian_upper,66,67.5,100.5,99.4,67.5,66,FALSE,Maas,V,yes
Placunidae,Ephippium,immobile,epifaunal,suspension,unattached,"Huber 2015; as subgenus of Placuna-- OK as unattached, see Yonge 1977, Matsukuma 1987",6,NA,NA,Tortonian-Messinian,12,8,Recent,0,0,12,8,0,0,FALSE,Rec,R,yes
Placunidae,Placuna,immobile,epifaunal,suspension,unattached,"Huber 2015; Yonge 1977, Matsukuma 1987; Allen 1985:365 discusses atrophy of byssus in adult form so that the animal rests freely on its side.",6,NA,NA,Ypresian,56,51.9,Recent,0,0,56,51.9,0,0,FALSE,Rec,R,yes
Radiolitidae,Radiolitella,immobile,semi-infaunal,photosymbiotic,unattached,"RV conical, LV cap-shaped - Treatise",2,1.5,2.5,Cenomanian_lower,100.5,99.4,Maastrichtian_upper,66,67.5,100.5,99.4,67.5,66,FALSE,Maas,V,yes
Radiolitidae,Radiolites,immobile,semi-infaunal,photosymbiotic,unattached,"RV conical orn w/strong longitudinal folds, LV small, conical or flat - Treatise; but some clingers acc to Gili et al. 1995",2,1.5,2.5,Albian_middle,108.83,106.75,Maastrichtian_upper,66,67.5,108.83,106.75,67.5,66,FALSE,Maas,V,yes
Radiolitidae,Rosellia,immobile,semi-infaunal,photosymbiotic,unattached,elevator - RV cylindrical - Alegret & Laurell 1998,2,1.5,2.5,Campanian_lower,83.6,81.685,Maastrichtian_lower,69.1,70.6,83.6,81.685,70.6,69.1,FALSE,Maas,V,yes
Radiolitidae,Sauvagesia,immobile,semi-infaunal,photosymbiotic,unattached,"RV conical to cylindro-conical, LV operculiform - Treatise",2,1.5,2.5,Albian_upper,104.67,102.585,Maastrichtian_upper,66,67.5,104.67,102.585,67.5,66,FALSE,Maas,V,yes
Radiolitidae,Tampsia,immobile,semi-infaunal,photosymbiotic,unattached,"elevator - RV conical-cylindrical, LV small w/gently convex center - Pons et al. 2013",2,1.5,2.5,Maastrichtian_lower,72.1,70.575,Maastrichtian_upper,66,67.5,72.1,70.575,67.5,66,FALSE,Maas,V,yes
Radiolitidae,Thiadensia,immobile,semi-infaunal,photosymbiotic,unattached,"large, poorly preserved ""may be Late Maastr derivative of Macgillavryia"" - Mitchell 2024, so assumed to be similar function to Macgillavryia, which is listed as an isolated elevator in Mitchell 2002 Table 2, so semi-infaunal",2,1.5,2.5,Maastrichtian_upper,69.05,67.525,Maastrichtian_upper,66,67.5,69.05,67.525,67.5,66,FALSE,Maas,V,yes
Radiolitidae,Thyrastylon,immobile,semi-infaunal,photosymbiotic,unattached,"elevator - Mitchell 2002; Steuber & L÷ser 2000, Johnson & Kauffman 1996:246",2,1.5,2.5,Maastrichtian_lower,72.1,70.575,Maastrichtian_upper,66,67.5,72.1,70.575,67.5,66,FALSE,Maas,V,yes
Radiolitidae,Trechmannites,immobile,semi-infaunal,photosymbiotic,unattached,"elevator - RV conical-cylindrical, LV small w/concave to gently convex center - Pons et al. 2013",2,1.5,2.5,Maastrichtian_lower,72.1,70.575,Maastrichtian_upper,66,67.5,72.1,70.575,67.5,66,FALSE,Maas,V,yes
Radiolitidae,Vautrinia,immobile,semi-infaunal,photosymbiotic,unattached,elevator - Khazaei et al. 2010,2,1.5,2.5,Campanian_upper,75.93,74.015,Maastrichtian_upper,66,67.5,75.93,74.015,67.5,66,FALSE,Maas,V,yes
Radiolitidae,Vermuntia,immobile,semi-infaunal,photosymbiotic,unattached,"semi-infaunal; RV conical to cylindro-conical, LV low cone w/central apex, apparently lacks significant attachment area as adult (although 2 small specimens found attached to antillocaprinid) -Mitchell 2024",2,1.5,2.5,Campanian_middle,79.77,77.85,Maastrichtian_upper,66,67.5,79.77,77.85,67.5,66,FALSE,Maas,V,yes
Requieniidae,Apricardia,immobile,epifaunal,photosymbiotic,cemented,"clinger - Steuber & L÷ser 2000, Skelton 2013, both for family",19,1.5,2.5,Cenomanian_lower,100.5,99.4,Maastrichtian_upper,66,67.5,100.5,99.4,67.5,66,FALSE,Maas,V,yes
Semelidae,Abra,mobile,deep_infaunal_siphonate,mixed_deposit/suspension,unattached,"presumed deep given potential syn with Syndosmya, whose depth observed by Alexander 1993; deposit feeding in Pohlo 1969 for several species in Abra",13,NA,NA,Selandian,61.6,60.4,Recent,0,0,61.6,60.4,0,0,FALSE,Rec,R,yes
Semelidae,Abrina,mobile,deep_infaunal_siphonate,mixed_deposit/suspension,unattached,"shell length to 16mm but deep pallial sinus, taken to be deep given similar to Syndosmya/Abra",13,NA,NA,Langhian_lower,16,15,Recent,0,0,16,15,0,0,FALSE,Rec,R,yes
Semelidae,Amphidesma,mobile,deep_infaunal_siphonate,mixed_deposit/suspension,unattached,"Coan et al. 2000; Rec spp 20-77mm in shell length, with sinus extending to 2/3 shell length in A. purpurascens",13,NA,NA,Danian_upper,63.8,62.7,Recent,0,0,63.8,62.7,0,0,FALSE,Rec,R,yes
Semelidae,Argyrodonax,mobile,shallow_infaunal_siphonate,mixed_deposit/suspension,unattached,shell length 5mm,20,NA,NA,NA,0,0,NA,0,0,0,0,0,0,FALSE,Rec,R,no
Semelidae,Cumingia,mobile,shallow_infaunal_siphonate,mixed_deposit/suspension,unattached,"Stanley 1970:177 C. tellinoides large (=20mm) animals burrow to a depth of 30-40mm, NMITA; C. californica nestles in crevices & boreholes (Coan et al. 2000)",20,NA,NA,Ypresian,56,51.9,Recent,0,0,56,51.9,0,0,FALSE,Rec,R,yes
Semelidae,Elegantula,immobile,nestler,suspension,unattached,"Coan et al. 2000, nestles in crevices, occasionally in Mytilus beds, and discarded bottles; type specimen of genus collected from a sponge; Huber 2015 describes shells as usually distorted by habtiat; presumed suspension feeder because of nestling habit and immobile",24,NA,NA,Pleistocene_lower,1.81,1.295,Recent,0,0,1.81,1.295,0,0,FALSE,Rec,R,yes
Semelidae,Endopleura,mobile,deep_infaunal_siphonate,mixed_deposit/suspension,unattached,"shell length to 23mm in Endopleura, and sinus extends to just beyond the midline, so taken to be deep given burrowing depth of same-sized Semele proficua buried to 30mm",13,NA,NA,Ionian,0.78,0.395,Recent,0,0,0.78,0.395,0,0,FALSE,Rec,R,yes
Semelidae,Ervilia,mobile,shallow_infaunal_siphonate,mixed_deposit/suspension,unattached,"NMITA as suspension feeding citing Morton 1990, Leonard-Pingel & Jackson 2013; as ""endobenthic suspension feeder"" in Morton 2014 citing Morton 1990; shell length 8-15mm in Rec species",20,NA,NA,Thanetian,59.2,57.6,Recent,0,0,59.2,57.6,0,0,FALSE,Rec,R,yes
Semelidae,Iacra,mobile,shallow_infaunal_siphonate,mixed_deposit/suspension,unattached,"Coan 2000; Rec species straddle 20mm shell length, so taken to be deep given relationship of shell length to burrowing depth observed in Stanley 1970",20,NA,NA,Langhian_lower,15.97,15.435,Recent,0,0,15.97,15.435,0,0,FALSE,Rec,R,yes
Semelidae,Leptomya,mobile,shallow_infaunal_siphonate,mixed_deposit/suspension,unattached,L. retiara as shallow in Cassie & Michael 1968:Table 1; shell length of Rec species is 3mm,20,NA,NA,Aquitanian_upper,21.74,21.09,Recent,0,0,21.74,21.09,0,0,FALSE,Rec,R,yes
Semelidae,Leptomyaria,mobile,shallow_infaunal_siphonate,mixed_deposit/suspension,unattached,shell lengths in Rec species 3-5mm,20,NA,NA,NA,0,0,NA,0,0,0,0,0,0,FALSE,Rec,R,no
Semelidae,Lonoa,mobile,shallow_infaunal_siphonate,mixed_deposit/suspension,unattached,shell lengths in Rec species to 7mm,20,NA,NA,NA,0,0,NA,0,0,0,0,0,0,FALSE,Rec,R,no
Semelidae,Montrouzieria,mobile,shallow_infaunal_siphonate,mixed_deposit/suspension,unattached,shell lengths in Rec species to 14mm,20,NA,NA,NA,0,0,NA,0,0,0,0,0,0,FALSE,Rec,R,no
Semelidae,Pinguimacoma,mobile,shallow_infaunal_siphonate,mixed_deposit/suspension,unattached,Southern Synthesis; shell length in Rec species to 11mm,20,NA,NA,NA,0,0,NA,0,0,0,0,0,0,FALSE,Rec,R,no
Semelidae,Rochefortina,mobile,shallow_infaunal_siphonate,mixed_deposit/suspension,unattached,Rec shell length to 5mm,20,NA,NA,NA,0,0,NA,0,0,0,0,0,0,FALSE,Rec,R,no
Semelidae,Scrobicularia,mobile,deep_infaunal_siphonate,mixed_deposit/suspension,unattached,Yonge & Thompson 1976:200 - fig shows burrowing to 14 cm; Pohlo 1969 notes deposit feeding for S. plana,13,NA,NA,Selandian,61.6,60.4,Recent,0,0,61.6,60.4,0,0,FALSE,Rec,R,yes
Semelidae,Semele,mobile,deep_infaunal_siphonate,mixed_deposit/suspension,unattached,"depth - Stead et al. 2002 (10 cm), and 21mm shell length burrowed to 30mm in Stanley 1970:177 for Semele proficua; S. proficua to 11cm in Domeneschi 1995 Veliger; nearly species of Semele Coan & Valentich Scott 2012 descibed with moderate or deep pallial sinuses, and at least half Rec. species to at least 50mm in shell length; in Leonard-Pingel & Jackson 2013; feeding - NMITA; Stanley 1970 never observed to deposit feed, and two species are suspension feeding in Pohlo 1969",13,NA,NA,Priabonian_upper,36,35,Recent,0,0,36,35,0,0,FALSE,Rec,R,yes
Semelidae,Syndosmya,mobile,deep_infaunal_siphonate,mixed_deposit/suspension,unattached,"Alexander et al. 1993:292 in upper 10cm of sediment for S. alba (type of genus) and Fig. 1 buried insanely deep to 150mm for a 25mm shell length, and has sinus extending to 3/4 shell length; deposit feeding in Pohlo 1969 for Abra alba (=Syndosmya)",13,NA,NA,Ypresian_lower,56,53.95,Recent,0,0,56,53.95,0,0,FALSE,Rec,R,yes
Semelidae,Theora,mobile,shallow_infaunal_siphonate,mixed_deposit/suspension,unattached,"Coan 2000; all Rec spp around 10mm, one to 24mm in shell length, and Huber 2015 says T. opalina is shallowly buried",20,NA,NA,Piacenzian,3.6,3.095,Recent,0,0,3.6,3.095,0,0,FALSE,Rec,R,yes
Semelidae,Thyellisca,mobile,shallow_infaunal_siphonate,mixed_deposit/suspension,unattached,following observation of surface deposit feeding in Yonge 1949:38 see also Coan 2000; shell length in Rec species to 13mm,20,NA,NA,NA,0,0,NA,0,0,0,0,0,0,FALSE,Rec,R,no
Solecurtidae,Azorinus,mobile,deep_infaunal_siphonate,suspension,unattached,for family Solecurtidae,5,NA,NA,Rupelian,33.9,31,Recent,0,0,33.9,31,0,0,FALSE,Rec,R,yes
Solecurtidae,Clunaculum,mobile,deep_infaunal_siphonate,suspension,unattached,for family Solecurtidae,5,NA,NA,NA,0,0,NA,0,0,0,0,0,0,FALSE,Rec,R,no
Solecurtidae,Mesopleura,mobile,deep_infaunal_siphonate,suspension,unattached,"burrowing depth ""seldom exceeds 20cm"" - Stanley 1970:175 (T. (M.) divisus)",5,NA,NA,Burdigalian,20.44,18.205,Recent,0,0,20.44,18.205,0,0,FALSE,Rec,R,yes
Solecurtidae,Protagelus,mobile,deep_infaunal_siphonate,suspension,unattached,Aberhan & Kiessling 2015 Supplement,5,1,3,Campanian_lower,83.6,81.685,Maastrichtian,66,69.1,83.6,81.685,65.5,65,TRUE,Maas,S,yes
Solecurtidae,Solecurtus,mobile,deep_infaunal_siphonate,suspension,unattached,"NMITA, citing Holme, N.A. 1961 (bottom fauna of the English Channel) and Yonge 1949:41; see also Bromley & Asgaard 1990; Checa 1993 says deep infaunal",5,NA,NA,Danian_upper,63.8,62.7,Recent,0,0,63.8,62.7,0,0,FALSE,Rec,R,yes
Solecurtidae,Tagelus,mobile,deep_infaunal_siphonate,suspension,unattached,"Stanley 1970:174, burrows to 40-45cm, Pohlo 1973, Moris et al. 1980:384, Southern Synthesis; Fraser 1967:116 observed crude swimming behavior in tanks and again in the wild.",5,NA,NA,Priabonian,37.8,35.85,Recent,0,0,37.8,35.85,0,0,FALSE,Rec,R,yes
Solemyidae,Acharax,swimming,deep_infaunal_asiphonate,chemosymbiotic,unattached,"for genus Solemya, almost no observational data for this genus, only differs from Solemya in the nature of its ligament",29,1,1,Emsian,407.6,400.45,Recent,0,0,407.6,400.45,0,0,FALSE,both,S,yes
Solemyidae,Austrosolemya,swimming,deep_infaunal_asiphonate,chemosymbiotic,unattached,for genus Solemya,29,NA,NA,NA,0,0,NA,0,0,0,0,0,0,FALSE,Rec,R,no
Solemyidae,Huxleyia,mobile,infaunal_asiphonate,chemosymbiotic,unattached,"Coan & Valentich-Scott 2012 say nothing about byssus, figure on p. 49 lacks a byssal gap (I think), so probably unattached. Assumed to be similar life mode to Nucinella; Oliver and Taylor 2012 for chemosymbiosis in Nucinella and Huxleyia",36,NA,NA,Lutetian-Bartonian,47.8,42.8,Recent,0,0,47.8,42.8,0,0,FALSE,Rec,R,yes
Solemyidae,Nucinella,mobile,infaunal_asiphonate,chemosymbiotic,unattached,"Allen 1978:399 ""Nucinella probably has a roving habit within the surface layers of the sediment, similar to that of Nucula""; in NMITA; Oliver and Taylor 2012 for chemosymbiosis in Nucinella and Huxleyia",36,1,2.75,Induan_lower,252.2,251.65,Recent,0,0,252.2,251.65,0,0,FALSE,both,S,yes
Solemyidae,Petrasma,swimming,deep_infaunal_asiphonate,chemosymbiotic,unattached,"Reid 1980 [P. reidi (Bernard 1980)] describes swimming via jets of water (in Solemya but re-ID'd by Huber 2015, apparently)",29,1,1,Callovian_lower,166.1,165.35,Recent,0,0,166.1,165.35,0,0,FALSE,both,S,yes
Solemyidae,Pseudacharax,swimming,deep_infaunal_asiphonate,chemosymbiotic,unattached,"doesnÆt construct burrows, ""keep actively moving in sediments with patchy sulfide distribution to access both reducing and oxygenated compounds (Krueger et al. 1996)."" - Hryniewicz et al. 2020",29,NA,NA,Ionian,0.78,0.395,Recent,0,0,0.78,0.395,0,0,FALSE,Rec,R,yes
Solemyidae,Solemya,swimming,deep_infaunal_asiphonate,chemosymbiotic,unattached,"Owen 1961:16 ""Swimming of Solemya, described by Drew (1900), was observed on one occasion and is spectacular. As one observer commented, 'It exhibits the sort of speed that in molluscs one normally associates with cephalopods'. That swimming is a normal feature of the behaviour of Solemya, however, is unlikely (Yonge, 1939).""; Stanley 1970 descr Y-shaped burrow; see Reid 1980 for observations of swimming; see Seike et al. 2024 for an intact Y-shaped burrow; Taylor et al. 2008 and Taylor & Glover 2010 describe a much reduced gut for members of the family, and note S. velum as harboring chemosymbionts. Chemo associations also discussed in Reid 1980.",29,1,1,Anisian_middle_upper,244.23,243.8,Recent,0,0,244.23,243.8,0,0,FALSE,both,S,yes
Solemyidae,Solemyarina,swimming,deep_infaunal_asiphonate,chemosymbiotic,unattached,for genus Solemya,29,NA,NA,Chattian,28.1,25.565,Recent,0,0,28.1,25.565,0,0,FALSE,Rec,R,yes
Solemyidae,Zesolemya,swimming,deep_infaunal_asiphonate,chemosymbiotic,unattached,for genus Solemya,29,NA,NA,Gelasian,2.59,2.2,Recent,0,0,2.59,2.2,0,0,FALSE,Rec,R,yes
Solenidae,Ensisolen,swimming,deep_infaunal_siphonate,suspension,unattached,"Morris et al. 1980:385 (for swimming); U. Oregon site: ""Solen sicarius can also both swim and jump (MacGinities 1935)"", also noted to burrow to depths of 3-40cm (Haderlie & Abbot 1980)",23,NA,NA,Aquitanian-Burdigalian,23.03,19.5,Recent,0,0,23.03,19.5,0,0,FALSE,Rec,R,yes
Solenidae,Solen,swimming,deep_infaunal_siphonate,suspension,unattached,"Morris et al. 1980:385 for S. roasceous and S. sicarius as swimming and burrowing to 30cm; Dong et al. 2021 (for swimming); Dong et al. 2021 for Solen strictus, swimming speed up to 12x their body length per second.",23,NA,NA,Thanetian,59,58,Recent,0,0,59,58,0,0,FALSE,Rec,R,yes
Solenidae,Solena,swimming,deep_infaunal_siphonate,suspension,unattached,"shell lengths in Rec spp to 221mm, sinus extending to 1/4 shell length, taken to be deep",23,NA,NA,Bartonian,41.2,39.5,Recent,0,0,41.2,39.5,0,0,FALSE,Rec,R,yes
Spheniopsidae,Grippina,mobile,shallow_infaunal_siphonate,carnivore,unattached,Morton et al. 2016 (Grippina paper):Fig. 24 shows hypothesized mode of life as shallow infaunal with siphons extended for capturing live prey. Note taxon barely 2mm in shell length!,16,NA,NA,Gelasian,2.59,2.2,Recent,0,0,2.59,2.2,0,0,FALSE,Rec,R,yes
Spheniopsidae,Spheniopsis,mobile,shallow_infaunal_siphonate,carnivore,unattached,Morton et al. 2016 (Speniopsis paper):Fig. 13 illustrats life position of S. brasiliensis as shallow infaunal with siphons extended for prey capture,16,NA,NA,Priabonian_upper,35.85,34.875,Recent,0,0,35.85,34.875,0,0,FALSE,Rec,R,yes
Spondylidae,Corallospondylus,immobile,epifaunal,suspension,cemented,Lamprell 2006:100 [for type sp Spondylus gussonii],7,NA,NA,Chattian,28.1,25.565,Recent,0,0,28.1,25.565,0,0,FALSE,Rec,R,yes
Spondylidae,Spondylus,immobile,epifaunal,suspension,cemented,"Lamprell 2003 indicates that Spondylus species can be byssate or unattached, but the majority seem to be cemented (e.g. S. varius obs. by Healy et al. 2001:581); see also Hansen & Surlyk 2014",7,2,3,Bajocian,170.3,169.3,Recent,0,0,170.3,169.3,0,0,FALSE,both,S,yes
Tancrediidae,Meekia,mobile,deep_infaunal_siphonate,suspension,unattached,"figure in Rhoads et al. 1972 suggests both shallow and deep; Pohlo 1982; F³rsich 1982:82 describes as having large posterior gape and thus likely a large siphon, so infers deep burrowing",5,1,2.5,Albian_lower,113,110.915,Maastrichtian_upper,66,67.5,113,110.915,67.5,66,FALSE,Maas,V,yes
Tancrediidae,Mygallia,mobile,deep_infaunal_siphonate,suspension,unattached,"figure in Rhoads et al. 1972 suggests both shallow and deep; Pohlo 1982; F³rsich 1982:82 describes as having large posterior gape and thus likely a large siphon, so infers deep burrowing",5,1,2.5,Albian_lower,113,110.915,Maastrichtian,66,69.1,113,110.915,69.1,66,FALSE,Maas,V,yes
Tancrediidae,Tancredia,mobile,deep_infaunal_siphonate,suspension,unattached,"figure in Rhoads et al. 1972 suggests both shallow and deep; Pohlo 1982; F³rsich 1982:82 describes as having large posterior gape and thus likely a large siphon, so infers deep burrowing",5,1,2.5,Norian_upper,214,211.75,Maastrichtian_upper,66,67.5,214,211.75,67.5,66,FALSE,Maas,V,yes
Tellinidae,Abranda,mobile,shallow_infaunal_siphonate,mixed_deposit/suspension,unattached,taken to be shallow bec adult sizes 7-14mm,20,NA,NA,Burdigalian_upper,18.21,17.09,Recent,0,0,18.21,17.09,0,0,FALSE,Rec,R,yes
Tellinidae,Acorylus,mobile,shallow_infaunal_siphonate,mixed_deposit/suspension,unattached,"taken to be shallow based on small adult size - 11-12 mm, Boss 1966:270 says pallial sinus reaching to anterior muscle",20,NA,NA,Bartonian,41.2,39.5,Recent,0,0,41.2,39.5,0,0,FALSE,Rec,R,yes
Tellinidae,Aenigmotellina,mobile,deep_infaunal_siphonate,mixed_deposit/suspension,unattached,deep based on species shell lengths 13-20mm,13,NA,NA,NA,0,0,NA,0,0,0,0,0,0,FALSE,Rec,R,no
Tellinidae,Aenona,mobile,shallow_infaunal_siphonate,mixed_deposit/suspension,unattached,"small small (23 x 19 mm) with ""moderate"" pallial sinus (Afshar 1969) and appears to lack posterior flexure",20,1,2.5,Cenomanian_lower,100.5,99.4,Maastrichtian_upper,66,67.5,100.5,99.4,67.5,66,FALSE,Maas,V,yes
Tellinidae,Aeretica,mobile,deep_infaunal_siphonate,mixed_deposit/suspension,unattached,"Huber 2015: ""deeply buried""; species 20-30mm",13,NA,NA,Aquitanian,23.03,21.735,Recent,0,0,23.03,21.735,0,0,FALSE,Rec,R,yes
Tellinidae,Afsharius,mobile,shallow_infaunal_siphonate,mixed_deposit/suspension,unattached,"spp range 8-15.9 mm, sinus to 2/3 shell length in A. mauritianus, which is relatively short for a tellin, taken to be shallow on combo of size and relative sinus length; family surf dep feeders in Southern Synthesis",20,NA,NA,NA,0,0,NA,0,0,0,0,0,0,FALSE,Rec,R,no
Tellinidae,Agnomyax,mobile,deep_infaunal_siphonate,mixed_deposit/suspension,unattached,"depth uncertain - moderate size (to 38.9 mm), but deep pallial sinus (Tashiro & Otsuka 1982)",13,1,2.5,Turonian_upper,91.17,90.485,Maastrichtian,66,69.1,91.17,90.485,69.1,66,FALSE,Maas,V,yes
Tellinidae,Alaona,mobile,deep_infaunal_siphonate,mixed_deposit/suspension,unattached,"spp range in size from 27-37mm, taken to be deep",13,NA,NA,NA,0,0,NA,0,0,0,0,0,0,FALSE,Rec,R,no
Tellinidae,Ameritella,mobile,shallow_infaunal_siphonate,mixed_deposit/suspension,unattached,"Stanley 1970:180 burrowed to 30mm; with posterior flexure; most species 10-25mm, right at the boundary between shallow and deep cutoff",20,NA,NA,Selandian,61.6,60.4,Recent,0,0,61.6,60.4,0,0,FALSE,Rec,R,yes
Tellinidae,Angulinides,mobile,deep_infaunal_siphonate,mixed_deposit/suspension,unattached,taken to be deep burrowers bec sizes range 38-52 mm,13,NA,NA,NA,0,0,NA,0,0,0,0,0,0,FALSE,Rec,R,no
Tellinidae,Angulus,mobile,deep_infaunal_siphonate,mixed_deposit/suspension,unattached,"spp range from 35-48mm, so taken to be deep; NMITA has it as surf dep feeder",13,NA,NA,Aquitanian-Burdigalian,23.03,19.5,Recent,0,0,23.03,19.5,0,0,FALSE,Rec,R,yes
Tellinidae,Apolymetis,mobile,deep_infaunal_siphonate,mixed_deposit/suspension,unattached,"Southern Synthesis ; deep based on rel large max size, spp range from 35-77mm",13,NA,NA,Aquitanian-Burdigalian,23.03,19.5,Recent,0,0,23.03,19.5,0,0,FALSE,Rec,R,yes
Tellinidae,Arcopagia,mobile,deep_infaunal_siphonate,mixed_deposit/suspension,unattached,"NMITA; taken to same as similar (sometimes jun syn) Johnsonella, Stanley 1970:184, spp range in size from 65-80m; one ""Arcopagia"" in Africa to 100mm shell length, so deep-infaunal",13,1,3,Campanian_lower,83.6,81.685,Recent,0,0,83.6,81.685,0,0,FALSE,both,S,yes
Tellinidae,Arcopaginula,mobile,deep_infaunal_siphonate,mixed_deposit/suspension,unattached,Southern Synthesis ; deep based on rel large max size 48mm,13,NA,NA,Lutetian_upper,44.5,42.85,Recent,0,0,44.5,42.85,0,0,FALSE,Rec,R,yes
Tellinidae,Arcopella,mobile,deep_infaunal_siphonate,mixed_deposit/suspension,unattached,taken as deep bec length to 20-25mm for species,13,NA,NA,Langhian-Serravallian,15.97,13.8,Recent,0,0,15.97,13.8,0,0,FALSE,Rec,R,yes
Tellinidae,Ardeamya,mobile,deep_infaunal_siphonate,mixed_deposit/suspension,unattached,deep based on rel large max size [30-68mm],13,NA,NA,Zanclean,5.33,4.465,Recent,0,0,5.33,4.465,0,0,FALSE,Rec,R,yes
Tellinidae,Asbjornsenia,mobile,shallow_infaunal_siphonate,mixed_deposit/suspension,unattached,taken to be shallow bc body sizes 5-12mm Huber 2015,20,NA,NA,Ionian,0.78,0.395,Recent,0,0,0.78,0.395,0,0,FALSE,Rec,R,yes
Tellinidae,Austromacoma,mobile,deep_infaunal_siphonate,mixed_deposit/suspension,unattached,Southern Synthesis ; deep based on rel large max size [34-55],13,NA,NA,Aquitanian-Burdigalian,23.03,19.5,Recent,0,0,23.03,19.5,0,0,FALSE,Rec,R,yes
Tellinidae,Bartschicoma,mobile,deep_infaunal_siphonate,mixed_deposit/suspension,unattached,deep based on rel large max size [48-75mm],13,NA,NA,Lutetian_upper,44.5,42.85,Recent,0,0,44.5,42.85,0,0,FALSE,Rec,R,yes
Tellinidae,Bathytellina,mobile,deep_infaunal_siphonate,mixed_deposit/suspension,unattached,Southern Synthesis ; deep based on rel large max size [20mm],13,NA,NA,NA,0,0,NA,0,0,0,0,0,0,FALSE,Rec,R,no
Tellinidae,Bertinella,mobile,deep_infaunal_siphonate,mixed_deposit/suspension,unattached,taken to be deep bc body sizeof extant sp 98.5 mm - Huber 2015 (Assuming Bertinella incl Johnsonella) [but Paleocene spp muchy smaller!],13,NA,NA,Danian_upper,63.8,62.7,Recent,0,0,63.8,62.7,0,0,FALSE,Rec,R,yes
Tellinidae,Bosemprella,mobile,deep_infaunal_siphonate,mixed_deposit/suspension,unattached,deep based on rel large max size [40mm],13,NA,NA,Aquitanian,23.03,21.735,Recent,0,0,23.03,21.735,0,0,FALSE,Rec,R,yes
Tellinidae,Cadella,mobile,shallow_infaunal_siphonate,mixed_deposit/suspension,unattached,taken to be shallow based on small adult size - 8-12 mm,20,NA,NA,Chattian,28.1,25.565,Recent,0,0,28.1,25.565,0,0,FALSE,Rec,R,yes
Tellinidae,Clathrotellina,mobile,deep_infaunal_siphonate,mixed_deposit/suspension,unattached,Southern Synthesis ; deep based on rel large max size,13,NA,NA,Piacenzian,3.6,3.095,Recent,0,0,3.6,3.095,0,0,FALSE,Rec,R,yes
Tellinidae,Coanyax,mobile,shallow_infaunal_siphonate,mixed_deposit/suspension,unattached,taken to be shallow bec adult size 9.5-11.3 mm,20,NA,NA,Piacenzian,3.6,3.095,Recent,0,0,3.6,3.095,0,0,FALSE,Rec,R,yes
Tellinidae,Confusella,mobile,shallow_infaunal_siphonate,mixed_deposit/suspension,unattached,taken to be shallow bc spp range 9-12mm in shell length,20,NA,NA,NA,0,0,NA,0,0,0,0,0,0,FALSE,Rec,R,no
Tellinidae,Cyclotellina,mobile,deep_infaunal_siphonate,mixed_deposit/suspension,unattached,Southern Synthesis ; deep based on rel large max size,13,NA,NA,Selandian-Thanetian,61.6,58.8,Recent,0,0,61.6,58.8,0,0,FALSE,Rec,R,yes
Tellinidae,Cymatoica,mobile,shallow_infaunal_siphonate,mixed_deposit/suspension,unattached,taken to be shallow based on small adult size - 10-20 mm,20,NA,NA,Tortonian,11.63,9.44,Recent,0,0,11.63,9.44,0,0,FALSE,Rec,R,yes
Tellinidae,Dallitellina,mobile,deep_infaunal_siphonate,mixed_deposit/suspension,unattached,deep based on rel large max size,13,NA,NA,Serravallian,13.82,12.725,Recent,0,0,13.82,12.725,0,0,FALSE,Rec,R,yes
Tellinidae,Dellius,mobile,deep_infaunal_siphonate,mixed_deposit/suspension,unattached,deep based on rel large max size,13,NA,NA,Ypresian_lower,56,53.95,Recent,0,0,56,53.95,0,0,FALSE,Rec,R,yes
